{"aggregate_sha256":"e451237925674fc683c100af9bec4d68db88d529e8d5638d3649841369a34f55","created_at":"2026-07-18T13:59:51.868988Z","created_by_image_id":"sha256:57d210c30bd4d8cd4e72bfe360ac217cd5f2625523259a5b58342c8d28d9eb12","dataset":{"name":"SWE-bench/SWE-bench_Multilingual","revision":"2b7aced941b4873e9cad3e76abbae93f481d1beb"},"files":[{"bytes":293,"path":"WRITER","scope":"control","sha256":"884070e095dc5630adf13a5b6b02f41245402e224001ae68ae12defe3a39027a"},{"bytes":7540,"path":"index.json","scope":"control","sha256":"0b4fbdb584c4475ebfc50fad44faef37249fb0e50c683dc8038580e0e337c979"},{"bytes":11144,"path":"sampling.jsonl","scope":"control","sha256":"fc6f35a8da497091b3acee7c219b3a8a596028f7a13895d32f4c19d9f1055fd9"},{"bytes":797,"path":"source-audit.json","scope":"control","sha256":"b309c78aac871543cc47a33bfaccc7707d8643e6398ad39f89b17b5e2c3bf79f"},{"bytes":252,"path":"tasks/axios__axios-4731.json","scope":"control","sha256":"e188f1edc4bdbb2a3ba4dd56f9b9a76d3acac2f2e1f5cd526037805486cdf28a"},{"bytes":252,"path":"tasks/axios__axios-4738.json","scope":"control","sha256":"83da74eb63e768b2197ac191dfe7d52468d434863d4e45b33e9fb83519b5211a"},{"bytes":253,"path":"tasks/axios__axios-5085.json","scope":"control","sha256":"44e761fed4039ea8676305a5562494fc2bacc010f8a3e63da65f82f66bfa5224"},{"bytes":254,"path":"tasks/axios__axios-5316.json","scope":"control","sha256":"b46bc52fb3bd72065416ca2f7c261517b0ef252165ccd15a335fa8b153da9072"},{"bytes":251,"path":"tasks/axios__axios-5892.json","scope":"control","sha256":"9b2ad54de3367a77c4b5786d06733e64deb4d23ba7b5c172a3b0509bbfdd74f3"},{"bytes":252,"path":"tasks/axios__axios-6539.json","scope":"control","sha256":"d1c56ed974e3f897f0b324e58e82ce2f570b46dc35616bbc884d21373095133b"},{"bytes":252,"path":"tasks/babel__babel-13928.json","scope":"control","sha256":"f1bf6b647ee82a497cfeaec49c7e775055c909918e52ee11cf35faa053af1f0d"},{"bytes":253,"path":"tasks/babel__babel-14532.json","scope":"control","sha256":"885aef891958d5faee6264a8f8d2fc803a81b1c2a7e6bdcf0b3650ec8f6aa6ca"},{"bytes":253,"path":"tasks/babel__babel-15445.json","scope":"control","sha256":"ccb8f7d60f101a7ffe84334a1ae829313bbbdf5285c73c6ba118e9fb9a1289aa"},{"bytes":254,"path":"tasks/babel__babel-15649.json","scope":"control","sha256":"ea931a2ef3586ee22b3a9162659f002ecc49d76fb6de89eeb946b97935572c44"},{"bytes":253,"path":"tasks/babel__babel-16130.json","scope":"control","sha256":"e846e202df4f49f608c6d8b3578dd72a14320b2914a72ca15fd15472b8aeaf47"},{"bytes":270,"path":"tasks/facebook__docusaurus-10130.json","scope":"control","sha256":"bd643a0b028dc60e4c6ce4aaeaacbfa81ede4668b86cf8b63dd5006177655adc"},{"bytes":270,"path":"tasks/facebook__docusaurus-10309.json","scope":"control","sha256":"acaf82bf967fa6ae742b8502ae6f6e805ef7b8fdb4b0d91c46621e5ecd2f65c2"},{"bytes":269,"path":"tasks/facebook__docusaurus-8927.json","scope":"control","sha256":"98e72c1cf6ef64a1c8c8189851ef751bcb06802f7d279cd5d15eed3b401455a9"},{"bytes":269,"path":"tasks/facebook__docusaurus-9183.json","scope":"control","sha256":"0a96a6839a3f5531dfe560b4e42bca2b27bd57b394c3ae882930a2c79af4d204"},{"bytes":268,"path":"tasks/facebook__docusaurus-9897.json","scope":"control","sha256":"3928e1d3416b6147923b08be9a235b22cdaa95fa760d66203210b6fc5a31f427"},{"bytes":280,"path":"tasks/immutable-js__immutable-js-2005.json","scope":"control","sha256":"860cfd21da61d6b5325aadcebd03676274ec34987c59f027555586cee1865afb"},{"bytes":280,"path":"tasks/immutable-js__immutable-js-2006.json","scope":"control","sha256":"09937a88a1ca9885968420bb478a56bf753ec1f6aa7aeaa949e1e1f41f6c1791"},{"bytes":261,"path":"tasks/mrdoob__three.js-25687.json","scope":"control","sha256":"fec2484b23cd2fcb2deb84d64d84f1b2577f6d8e73a5fb831511601a8b7551bf"},{"bytes":261,"path":"tasks/mrdoob__three.js-26589.json","scope":"control","sha256":"1d648e4f130db527f2c5a694fbd3746a44dbfd0b63fcfaa302ff04070bad60c2"},{"bytes":261,"path":"tasks/mrdoob__three.js-27395.json","scope":"control","sha256":"efce7c3572e0595d1a71c13ae47846727bde21abeb50e9424a6289f6c583f5e6"},{"bytes":260,"path":"tasks/preactjs__preact-2757.json","scope":"control","sha256":"ae031ba890dfeb616f2ea5d36ca5221aec46433d2155159ef66c0b11fca7ac02"},{"bytes":260,"path":"tasks/preactjs__preact-2896.json","scope":"control","sha256":"c9e191ed5c1f0ab8bed78ff39e47439751b5cad5e311e2977c8c69c438e39d9f"},{"bytes":259,"path":"tasks/preactjs__preact-2927.json","scope":"control","sha256":"6c1e13c7b16f036285195664c1c59b33d3d58c20f8f322a9efad89371165cbed"},{"bytes":259,"path":"tasks/preactjs__preact-3010.json","scope":"control","sha256":"cbe2db2f0097fc03b2360884460048bcf508e1f981b68a6759b8547ccae324d1"},{"bytes":259,"path":"tasks/preactjs__preact-3062.json","scope":"control","sha256":"7953793d5976e0f8cd6b896e94b6a9e25648fc549d743175d8d5b44e46d99c12"},{"bytes":261,"path":"tasks/preactjs__preact-3345.json","scope":"control","sha256":"558915e613c0d69ba77f4aa73062a7a75fdaeea790bed7c5f70894785d197c29"},{"bytes":260,"path":"tasks/preactjs__preact-3454.json","scope":"control","sha256":"24aad3c5147ce32e4552a056be1484dce75ea3927bff77e9b66e1c8f70673624"},{"bytes":260,"path":"tasks/preactjs__preact-3562.json","scope":"control","sha256":"d8a65117ea8120e9c7d10d6f75af503c9c1b35afc8fe4c744c3ce031f1e926d6"},{"bytes":261,"path":"tasks/preactjs__preact-3567.json","scope":"control","sha256":"49fd7cef55715f38d3bb6c01b70b4fab7a282f7dfdc83d73245f8413abd7e85a"},{"bytes":260,"path":"tasks/preactjs__preact-3689.json","scope":"control","sha256":"7d6a7482c256d203fec373ca9d6eee9372eb3520b572b3de8a66fbfbc37feb38"},{"bytes":260,"path":"tasks/preactjs__preact-3739.json","scope":"control","sha256":"52a7a148a8ee693a7616cb257c8d9d9df5501b10d7510f63078ac60e5312eea1"},{"bytes":261,"path":"tasks/preactjs__preact-3763.json","scope":"control","sha256":"e1a7e13ecb4b4042093a8916b624d117f577f1d914911377511270e2741e2978"},{"bytes":259,"path":"tasks/preactjs__preact-4152.json","scope":"control","sha256":"7b45bd30c785551b8a38b305722b46bf16a6262d3a235dcffdb82b45bb323da1"},{"bytes":260,"path":"tasks/preactjs__preact-4182.json","scope":"control","sha256":"e83a9d60455a30a20f0f8b7590b54940b99b1c4ef9b3b99738c256747db2c3d8"},{"bytes":260,"path":"tasks/preactjs__preact-4245.json","scope":"control","sha256":"85cd52e4f652e247d9f598b29fb26d62c4e2e9b3a2c97b5afe10a5aeccdee5f3"},{"bytes":260,"path":"tasks/preactjs__preact-4316.json","scope":"control","sha256":"b67887a8db326e13180b4c0525a55b9684455f536d2a82b49e3afc030a40444f"},{"bytes":260,"path":"tasks/preactjs__preact-4436.json","scope":"control","sha256":"4dd74f40e358407819c39636ba0b6010da1b4be8499852a9a4d5986f6eac6e5e"},{"bytes":251,"path":"tasks/vuejs__core-11589.json","scope":"control","sha256":"d4b836523accef5b63e1664e5c033fb12756008759f9d4e86e2d0015d306f4e6"},{"bytes":252,"path":"tasks/vuejs__core-11739.json","scope":"control","sha256":"cdf33d4eb6fa8b912c53b51006f4043c546cbbcd1145c3303e819388d36ce111"},{"bytes":252,"path":"tasks/vuejs__core-11870.json","scope":"control","sha256":"006d38f72644b214a1778cc292cb07f3dd1af3fed2c77533333f22f365c78c36"},{"bytes":252,"path":"tasks/vuejs__core-11899.json","scope":"control","sha256":"bfca8b2dd6ed0d00911ced02f120ba74ac23e41903d385de1379f98580e8e171"},{"bytes":250,"path":"tasks/vuejs__core-11915.json","scope":"control","sha256":"9f73c2189d325fcf149c6d1994287092f1f2b20e006caf7a2d73b2da5d2cc44d"},{"bytes":284948,"path":"evaluation.jsonl","scope":"private","sha256":"9813e5035f3454784c0e887d5a613c1656f3d05ab293145d22959359636e2fd3"},{"bytes":7589,"path":"index.json","scope":"private","sha256":"e0fc08d17eb5f6c144944e4a63551269d9c19a5f07fbad19b1de7a4f64a0f13c"},{"bytes":2768,"path":"tasks/axios__axios-4731.json","scope":"private","sha256":"b93b4036fb98e2f4484f3e8226b5adf0ed8f83c125ffc5048af6512ab495af2e"},{"bytes":2436,"path":"tasks/axios__axios-4738.json","scope":"private","sha256":"4dda73f4e57d7d83c01566765cb2281585c62130f5ffb0e9e14d861ccb377025"},{"bytes":4400,"path":"tasks/axios__axios-5085.json","scope":"private","sha256":"ced9593a18591644d88c3960c666dc46ac151782525aab521d39b04e91bc4127"},{"bytes":18969,"path":"tasks/axios__axios-5316.json","scope":"private","sha256":"84fe3e33ecc002386029a2e8d4b1ef931fe1318fcca69565dec89d1c191b8e47"},{"bytes":5936,"path":"tasks/axios__axios-5892.json","scope":"private","sha256":"a592340952c75bf326d9ca45bdef7a2e635dcb5648c674e6a9fae25bae165f50"},{"bytes":3889,"path":"tasks/axios__axios-6539.json","scope":"private","sha256":"22a2645f94879d13320a99113c32a472011f60201bd33dd60a1d6b442c8b2b54"},{"bytes":26019,"path":"tasks/babel__babel-13928.json","scope":"private","sha256":"ccc612582290d4484fb2680addd24a4305d903c094e0a5ce472b2cd66d348cd2"},{"bytes":15258,"path":"tasks/babel__babel-14532.json","scope":"private","sha256":"e73b9dcafd55260f5c5a263c7b1d3fb1fccede52adb81481447f57dc6d0eccf8"},{"bytes":4574,"path":"tasks/babel__babel-15445.json","scope":"private","sha256":"ba222c18ecc280dcf598935f7d3ca1398d1e04484ae5434937d4be5cda0d3228"},{"bytes":8414,"path":"tasks/babel__babel-15649.json","scope":"private","sha256":"51474189901793262a1f892a261118b9e96f0389fff7df94c5dcdd94539eef4c"},{"bytes":6988,"path":"tasks/babel__babel-16130.json","scope":"private","sha256":"62344a3134ab075882d846c6e9e19b54607031cc50096c0cbe58b8393a3f8ff4"},{"bytes":4446,"path":"tasks/facebook__docusaurus-10130.json","scope":"private","sha256":"be1083413bc7225a616cf1f705c7c82fac700cf233586650d9e8ee4517bb6d99"},{"bytes":15568,"path":"tasks/facebook__docusaurus-10309.json","scope":"private","sha256":"d8f56a3a4ce16ccdcbc4dc6e5965a8fd5bf3cef73572bfd8c2c98d23f06933b9"},{"bytes":8611,"path":"tasks/facebook__docusaurus-8927.json","scope":"private","sha256":"d3ba27fdcec6030674f8a301832bd1592480a452cf4f4afd6e0d746c0afa2a1b"},{"bytes":6963,"path":"tasks/facebook__docusaurus-9183.json","scope":"private","sha256":"4e4e51c7f77589e5f05de00f5e25e42eee026d9dc4c958acae32f2c55ae5a8b8"},{"bytes":7020,"path":"tasks/facebook__docusaurus-9897.json","scope":"private","sha256":"9b6014a1c3be4e8adb0cfe414ac29d0f0ef2b3da0021d2f638a1578fe970a30c"},{"bytes":4480,"path":"tasks/im